title,link,description,date,authorHackers Used Fake Job Offer to Hack and Steal $540 Million from Axie Infinity,https://thehackernews.com/2022/07/hackers-used-fake-job-offer-to-hack-and.html,"The $540 million hack of Axie Infinity's  Ronin Bridge  in late March 2022 was the consequence of one of its former employees getting tricked by a fraudulent job offer on LinkedIn, it has emerged.   According to a report from  The Block  published last week citing two people familiar with the matter, a senior engineer at the company was duped into applying for a job at a non-existent company, causing the individual to download a fake offer document disguised as a PDF.  ""After what one source described as multiple rounds of interviews, a Sky Mavis engineer was offered a job with an extremely generous compensation package,"" the Block reported.   The offer document subsequently acted as a conduit to deploy malware designed to breach Ronin's network, ultimately facilitating one of the crypto sector's biggest hacks to date.  ""Sky Mavis employees are under constant advanced spear-phishing attacks on various social channels and one employee was compromised,"" t","July 10, 2022",Ravie Lakshmanan
PyPI Repository Makes 2FA Security Mandatory for Critical Python Projects,https://thehackernews.com/2022/07/pypi-repository-makes-2af-security.html,"The maintainers of the official third-party software repository for Python have begun imposing a new two-factor authentication (2FA) condition for projects deemed ""critical.""  ""We've begun rolling out a 2FA requirement: soon, maintainers of critical projects must have 2FA enabled to publish, update, or modify them,"" Python Package Index (PyPI)  said  in a tweet last week.  ""Any maintainer of a critical project (both 'Maintainers' and 'Owners') are included in the 2FA requirement,"" it  added .   Additionally, the developers of critical projects who have not previously turned on 2FA on PyPi are being offered free hardware security keys from the Google Open Source Security Team.  PyPI, which is run by the Python Software Foundation, houses more than 350,000 projects, of which over  3,500 projects  are said to be tagged with a ""critical"" designation.  According to the repository maintainers, any project accounting for the top 1%","July 10, 2022",Ravie Lakshmanan
Researchers Warn of Raspberry Robin's Worm Targeting Windows Users,https://thehackernews.com/2022/07/researchers-warn-of-raspberry-robins.html,"Cybersecurity researchers are drawing attention to an ongoing wave of attacks linked to a threat cluster tracked as Raspberry Robin that's behind a Windows malware with worm-like capabilities.   Describing it as a ""persistent"" and ""spreading"" threat, Cybereason  said  it observed a number of victims in Europe.  The infections involve a worm that propagates over removable USB devices containing malicious a .LNK file and leverages compromised QNAP network-attached storage (NAS) devices for command-and-control. It was  first documented  by researchers from Red Canary in May 2022.   Also codenamed  QNAP worm  by Sekoia, the malware leverages a legitimate Windows installer binary called ""msiexec.exe"" to download and execute a malicious shared library (DLL) from a compromised QNAP NAS appliance.  ""To make it harder to detect, Raspberry Robin leverages process injections in three legitimate Windows system processes,"" Cybereason researcher Loïc Cast","July 08, 2022",Ravie Lakshmanan
Researchers Detail Techniques LockBit Ransomware Using to Infect its Targets,https://thehackernews.com/2022/07/researchers-detail-techniques-lockbit.html,"LockBit ransomware attacks are constantly evolving by making use of a wide range of techniques to infect targets while also taking steps to disable endpoint security solutions.  ""The affiliates that use LockBit's services conduct their attacks according to their preference and use different tools and techniques to achieve their goal,"" Cybereason security analysts Loïc Castel and Gal Romano  said . ""As the attack progresses further along the kill chain, the activities from different cases tend to converge to similar activities.""  LockBit, which operates on a ransomware-as-a-service (RaaS) model like most groups, was first observed in September 2019 and has since emerged as the most dominant ransomware strain this year, surpassing other well-known groups like  Conti ,  Hive , and  BlackCat .   This involves the malware authors licensing access to affiliates, who execute the attacks in exchange for using their tools and infrastructure and earn as much as 80% of ea","July 08, 2022",Ravie Lakshmanan
Microsoft Temporarily Rolls Back Plan to Block Office VBA Macros by Default,https://thehackernews.com/2022/07/microsoft-quietly-rolls-back-plan-to.html,"Five months after announcing plans to disable Visual Basic for Applications (VBA) macros by default in the Office productivity suite, Microsoft appears to have rolled back its plans.  ""Based on feedback received, a rollback has started,"" Microsoft employee Angela Robertson  said  in a July 6 comment. ""An update about the rollback is in progress. I apologize for any inconvenience of the rollback starting before the update about the change was made available.""  When reached by The Hacker News, Redmond said its decision to reverse course was temporary and that it's working to incorporate further usability improvements.  ""Following user feedback, we have rolled back this change temporarily while we make some additional changes to enhance usability,"" a Microsoft spokesperson said. ""This is a temporary change, and we are fully committed to making the default change for all users. Regardless of the default setting, customers can block internet macros th","July 08, 2022",Ravie Lakshmanan
Why Developers Hate Changing Language Versions,https://thehackernews.com/2022/07/why-developers-hate-changing-language.html,"Progress powers technology forward. But progress also has a cost: by adding new capabilities and features, the developer community is constantly adjusting the building blocks. That includes the fundamental languages used to code technology solutions.  When the building blocks change, the code behind the technology solution must change too. It's a challenging and time-consuming exercise that drains resources. But what if there's an alternative?  The problem: reading code someone else wrote  Let's take a step back and take a look at one of the fundamental challenges in development: editing someone else's code. Editing code you just wrote, or wrote a couple of weeks ago, is just fine. But editing your own code written years ago – never mind someone else's code - that's a different story.  In-house code style rules can help but there are always odd naming conventions for variables and functions, or unusual choices for algorithms. Arguably, a programmer's abilit","July 08, 2022",The Hacker News
Experts Uncover 350 Browser Extension Variants Used in ABCsoup Adware Campaign,https://thehackernews.com/2022/07/experts-uncover-350-browser-extension.html,"A malicious browser extension with 350 variants is masquerading as a Google Translate add-on as part of an adware campaign targeting Russian users of Google Chrome, Opera, and Mozilla Firefox browsers.  Mobile security firm Zimperium dubbed the malware family  ABCsoup , stating the ""extensions are installed onto a victim's machine via a Windows-based executable, bypassing most endpoint security solutions, along with the security controls found in the official extension stores.""  The rogue browser add-ons come with the same extension ID as that of Google Translate — "" aapbdbdomjkkjkaonfhkkikfgjllcleb "" — in an attempt to trick users into believing that they have installed a legitimate extension.   The extensions are not available on the official browser web stores themselves. Rather they are delivered through different Windows executables that install the add-on on the victim's web browser.  In the event the targeted user already has the Google Translate ext","July 08, 2022",Ravie Lakshmanan
"TrickBot Gang Shifted its Focus on ""Systematically"" Targeting Ukraine",https://thehackernews.com/2022/07/trickbot-malware-shifted-its-focus-on.html,"In what's being described as an ""unprecedented"" twist, the operators of the TrickBot malware have resorted to systematically targeting Ukraine since the onset of the war in late February 2022.  The group is believed to have orchestrated at least six phishing campaigns aimed at targets that align with Russian state interests, with the emails acting as lures for delivering malicious software such as IcedID, CobaltStrike, AnchorMail, and  Meterpreter .  Tracked under the names ITG23,  Gold Blackburn , and Wizard Spider, the  financially motivated cybercrime gang  is known for its development of the TrickBot banking trojan and was  subsumed  into the now-discontinued  Conti ransomware cartel  earlier this year.  But merely weeks later, the actors associated with the group resurfaced with a revamped version of the  AnchorDNS  backdoor called  AnchorMail  that uses SMTPS and IMAP protocols for command-and-control communications.   ""ITG23's campaigns against Ukraine ar","July 07, 2022",Ravie Lakshmanan
"Over 1,200 NPM Packages Found Involved in ""CuteBoi"" Cryptomining Campaign",https://thehackernews.com/2022/07/over-1200-npm-packages-found-involved.html,"Researchers have disclosed what they say could be an attempt to kick-off a new large-scale cryptocurrency mining campaign targeting the NPM JavaScript package repository.  The malicious activity, attributed to a software supply chain threat actor dubbed  CuteBoi , involves an array of 1,283 rogue modules that were published in an automated fashion from over 1,000 different user accounts.  ""This was done using automation which includes the ability to pass the NPM 2FA challenge,"" Israeli application security testing company Checkmarx  said . ""This cluster of packages seems to be a part of an attacker experimenting at this point.""   All the released packages in question are said to harbor near-identical source code from an already existing package named eazyminer that's used to mine Monero by means of utilizing unused resources on web servers.  One notable modification entails the URL to which the mined cryptocurrency should be sent, although installing the rogue","July 07, 2022",Ravie Lakshmanan
"Apple's New ""Lockdown Mode"" Protects iPhone, iPad, and Mac Against Spyware",https://thehackernews.com/2022/07/apples-new-lockdown-mode-protects.html,"Apple on Wednesday announced it plans to introduce an enhanced security setting called  Lockdown Mode  in iOS 16, iPadOS 16, and macOS Ventura to safeguard high-risk users against ""highly targeted cyberattacks.""  The ""extreme, optional protection"" feature, now available for preview in beta versions of its upcoming software, is designed to counter a surge in threats posed by private companies developing state-sponsored surveillanceware such as  Pegasus ,  DevilsTongue ,  Predator , and  Hermit .   Lockdown Mode, when enabled, ""hardens device defenses and strictly limits certain functionalities, sharply reducing the attack surface that potentially could be exploited by highly targeted mercenary spyware,"" Apple  said  in a statement.   This includes blocking most message attachment types other than images and disabling link previews in Messages; rendering inoperative just-in-time ( JIT ) JavaScript compilation; removing support for shared albums in Photos; a","July 07, 2022",Ravie Lakshmanan
The Age of Collaborative Security: What Tens of Thousands of Machines Witness,https://thehackernews.com/2022/07/the-age-of-collaborative-security-what.html,"Disclaimer: This article is meant to give insight into cyber threats as seen by the community of users of CrowdSec.  What can tens of thousands of machines tell us about illegal hacker activities?  Do you remember that scene in Batman - The Dark Knight, where Batman uses a system that aggregates active sound data from countless mobile phones to create a meta sonar feed of what is going on at any given place?   It is an interesting analogy with what we do at CrowdSec. By aggregating intrusion signals from our community, we can offer a clear picture of what is going on in terms of illegal hacking in the world.  After 2 years of activity and analyzing 1 million intrusion signals daily from tens of thousands of users in 160 countries, we start having an accurate ""Batman sonar"" global feed of cyber threats. And there are some interesting takeaways to outline.  A cyber threat with many faces   First of all, the global cyber threat is highly versatile. What do we see when looking at the type","July 07, 2022",The Hacker News
Researchers Warn of New OrBit Linux Malware That Hijacks Execution Flow,https://thehackernews.com/2022/07/researchers-warn-of-new-orbit-linux.html,"Cybersecurity researchers have taken the wraps off a new and entirely undetected Linux threat dubbed  OrBit , signally a growing trend of malware attacks geared towards the popular operating system.  The malware gets its name from one of the filenames that's utilized to temporarily store the output of executed commands (""/tmp/.orbit""), according to cybersecurity firm Intezer.  ""It can be installed either with persistence capabilities or as a volatile implant,"" security researcher Nicole Fishbein  said . ""The malware implements advanced evasion techniques and gains persistence on the machine by hooking key functions, provides the threat actors with remote access capabilities over SSH, harvests credentials, and logs TTY commands.""  OrBit is the fourth Linux malware to have come to light in a short span of three months after  BPFDoor ,  Symbiote , and  Syslogk .   The malware also functions a lot like Symbiote in that it's designed to infect all of t","July 06, 2022",Ravie Lakshmanan
Cisco and Fortinet Release Security Patches for Multiple Products,https://thehackernews.com/2022/07/cisco-and-fortinet-release-security.html,"Cisco on Wednesday rolled out patches for  10 security flaws  spanning multiple products, one of which is rated Critical in severity and could be weaponized to conduct absolute path traversal attacks.  The issues, tracked as  CVE-2022-20812 and CVE-2022-20813 , affect Cisco Expressway Series and Cisco TelePresence Video Communication Server (VCS) and ""could allow a remote attacker to overwrite arbitrary files or conduct null byte poisoning attacks on an affected device,"" the company  said  in an advisory.  CVE-2022-20812 (CVSS score: 9.0), which concerns a case of arbitrary file overwrite in the cluster database API, requires the authenticated, remote attacker to have Administrator read-write privileges on the application so as to be able to mount path traversal attacks as a root user.  ""This vulnerability is due to insufficient input validation of user-supplied command arguments,"" the company said. ""An attacker could exploit this vulnerability by authenticati","July 06, 2022",Ravie Lakshmanan
NIST Announces First Four Quantum-Resistant Cryptographic Algorithms,https://thehackernews.com/2022/07/nist-announces-first-four-quantum.html,"The U.S. Department of Commerce's National Institute of Standards and Technology (NIST) has  chosen  the first set of quantum-resistant encryption algorithms that are designed to ""withstand the assault of a future quantum computer.""  The post-quantum cryptography ( PQC ) technologies include the  CRYSTALS-Kyber  algorithm for general encryption, and  CRYSTALS-Dilithium ,  FALCON , and  SPHINCS+  for digital signatures.   ""Three of the selected algorithms are based on a family of math problems called structured lattices, while SPHINCS+ uses hash functions,"" NIST, which kicked off the standardization process in January 2017,  said  in a statement.  Cryptography, which underpins the security of information in modern computer networks, derives its strength from the difficulty of solving mathematical problems — e.g., factoring large composite integers — using traditional computers.  Quantum computers, should they mature enough, pose a  huge impact  on the current pu","July 06, 2022",Ravie Lakshmanan
